territory_id,homepage,state_code,raw_publishing_entity,matched_territory_name
1506195,http://www.diariomunicipal.com.br/famep,PA,Prefeitura Municipal de Rurópolis,ruropolis
1506203,http://www.diariomunicipal.com.br/famep,PA,Prefeitura Municipal de Salinópolis,salinopolis
1506302,http://www.diariomunicipal.com.br/famep,PA,Prefeitura Municipal de Salvaterra,salvaterra
1506559,http://www.diariomunicipal.com.br/famep,PA,Prefeitura Municipal de Santa Luzia do Pará,santa luzia para
1506807,http://www.diariomunicipal.com.br/famep,PA,Prefeitura Municipal de Santarém,santarem
1506906,http://www.diariomunicipal.com.br/famep,PA,Prefeitura Municipal de Santarém Novo,santarem novo
1507102,http://www.diariomunicipal.com.br/famep,PA,Prefeitura Municipal de São Caetano de Odivelas,sao caetano odivelas
1507151,http://www.diariomunicipal.com.br/famep,PA,Prefeitura Municipal de São Domingos do Araguaia,sao domingos araguaia
1507300,http://www.diariomunicipal.com.br/famep,PA,Prefeitura Municipal de São Félix do Xingú,sao felix xingu
1507409,http://www.diariomunicipal.com.br/famep,PA,Prefeitura Municipal de São Francisco do Pará,sao francisco para
1507458,http://www.diariomunicipal.com.br/famep,PA,Prefeitura Municipal de São Geraldo do Araguaia,sao geraldo araguaia
1507474,http://www.diariomunicipal.com.br/famep,PA,Prefeitura Municipal de São João de Pirabas,sao joao pirabas
1507508,http://www.diariomunicipal.com.br/famep,PA,Prefeitura Municipal de São João do Araguaia,sao joao araguaia
1507607,http://www.diariomunicipal.com.br/famep,PA,Prefeitura Municipal de São Miguel do Guamá,sao miguel guama
1507755,http://www.diariomunicipal.com.br/famep,PA,Prefeitura Municipal de Sapucaia,sapucaia
1507805,http://www.diariomunicipal.com.br/famep,PA,Prefeitura Municipal de Senador José Porfirio,senador jose porfirio
1507904,http://www.diariomunicipal.com.br/famep,PA,Prefeitura Municipal de Soure,soure
1508001,http://www.diariomunicipal.com.br/famep,PA,Prefeitura Municipal de Tomé-Açu,tome acu
1508035,http://www.diariomunicipal.com.br/famep,PA,Prefeitura Municipal de Tracuateua,tracuateua
1508050,http://www.diariomunicipal.com.br/famep,PA,Prefeitura Municipal de Trairão,trairao
1508084,http://www.diariomunicipal.com.br/famep,PA,Prefeitura Municipal de Tucumã,tucuma
1508100,http://www.diariomunicipal.com.br/famep,PA,Prefeitura Municipal de Tucuruí,tucurui
1508126,http://www.diariomunicipal.com.br/famep,PA,Prefeitura Municipal de Ulianópolis,ulianopolis
1508308,http://www.diariomunicipal.com.br/famep,PA,Prefeitura Municipal de Viseu,viseu
1508407,http://www.diariomunicipal.com.br/famep,PA,Prefeitura Municipal de Xinguara,xinguara
2501153,http://www.diariomunicipal.com.br/famup,PB,Município de Areia de Baraúnas,areia baraunas
2503001,http://www.diariomunicipal.com.br/famup,PB,Município de Caaporã,caapora
2503100,http://www.diariomunicipal.com.br/famup,PB,Município de Cabaceiras,cabaceiras
2504405,http://www.diariomunicipal.com.br/famup,PB,Município de Conceição,conceicao
2504504,http://www.diariomunicipal.com.br/famup,PB,Município de Condado,condado
2507804,http://www.diariomunicipal.com.br/famup,PB,Município de Junco do Seridó,junco serido
2508505,http://www.diariomunicipal.com.br/famup,PB,Município de Livramento,livramento
2510808,http://www.diariomunicipal.com.br/famup,PB,Município de Patos,patos
2511004,http://www.diariomunicipal.com.br/famup,PB,Município de Pedra Branca,pedra branca
2513000,http://www.diariomunicipal.com.br/famup,PB,Município de Salgadinho,salgadinho
2513802,http://www.diariomunicipal.com.br/famup,PB,Município de Santa Teresinha,santa teresinha
2514909,http://www.diariomunicipal.com.br/famup,PB,Município de São Mamede,sao mamede
2515807,http://www.diariomunicipal.com.br/famup,PB,Município de Serra Redonda,serra redonda
2500700,http://www.diariomunicipal.com.br/famup,PB,Prefeitura de São João do Rio do Peixe,sao joao rio peixe
2514800,http://www.diariomunicipal.com.br/famup,PB,Prefeitura de São José dos Cordeiros,sao jose cordeiros
2500106,http://www.diariomunicipal.com.br/famup,PB,Prefeitura Municipal de Água Branca,agua branca
2500403,http://www.diariomunicipal.com.br/famup,PB,PREFEITURA MUNICIPAL DE ALAGOA NOVA,alagoa nova
2500601,http://www.diariomunicipal.com.br/famup,PB,PREFEITURA MUNICIPAL DE ALHANDRA,alhandra
2500775,http://www.diariomunicipal.com.br/famup,PB,PREFEITURA MUNICIPAL DE APARECIDA,aparecida
2500908,http://www.diariomunicipal.com.br/famup,PB,PREFEITURA MUNICIPAL DE ARARA,arara
2501203,http://www.diariomunicipal.com.br/famup,PB,Prefeitura Municipal de Areial,areial
2501609,http://www.diariomunicipal.com.br/famup,PB,PREFEITURA MUNICIPAL DE BARRA DE SANTA ROSA,barra santa rosa
2501708,http://www.diariomunicipal.com.br/famup,PB,PREFEITURA MUNICIPAL DE BARRA DE SÃO MIGUEL,barra sao miguel
2501807,http://www.diariomunicipal.com.br/famup,PB,PREFEITURA MUNICIPAL DE BAYEUX,bayeux
2502052,http://www.diariomunicipal.com.br/famup,PB,Prefeitura Municipal de Bernardino Batista,bernardino batista
2502151,http://www.diariomunicipal.com.br/famup,PB,PREFEITURA MUNICIPAL DE BOA VISTA,boa vista
2502409,http://www.diariomunicipal.com.br/famup,PB,PREFEITURA MUNICIPAL DE BONITO DE SANTA FÉ,bonito santa fe
2503407,http://www.diariomunicipal.com.br/famup,PB,PREFEITURA MUNICIPAL DE CACIMBA DE AREIA,cacimba areia
2503506,http://www.diariomunicipal.com.br/famup,PB,Prefeitura Municipal de Cacimba de Dentro,cacimba dentro
2503555,http://www.diariomunicipal.com.br/famup,PB,PREFEITURA MUNICIPAL DE CACIMBAS,cacimbas
2503605,http://www.diariomunicipal.com.br/famup,PB,PREFEITURA MUNICIPAL DE CAIÇARA,caicara
2503753,http://www.diariomunicipal.com.br/famup,PB,PREFEITURA MUNICIPAL DE CAJAZEIRINHAS,cajazeirinhas
2503902,http://www.diariomunicipal.com.br/famup,PB,Prefeitura Municipal de Camalaú,camalau
2504207,http://www.diariomunicipal.com.br/famup,PB,PREFEITURA MUNICIPAL DE CATINGUEIRA,catingueira
2504801,http://www.diariomunicipal.com.br/famup,PB,PREFEITURA MUNICIPAL DE COREMAS,coremas
2505006,http://www.diariomunicipal.com.br/famup,PB,Prefeitura Municipal de Cubati,cubati
2505303,http://www.diariomunicipal.com.br/famup,PB,Prefeitura Municipal de Curral Velho,curral velho
2505600,http://www.diariomunicipal.com.br/famup,PB,Prefeitura Municipal de Diamante,diamante
2505907,http://www.diariomunicipal.com.br/famup,PB,Prefeitura Municipal de Emas,emas
2506004,http://www.diariomunicipal.com.br/famup,PB,PREFEITURA MUNICIPAL DE ESPERANÇA,esperanca
2502607,http://www.diariomunicipal.com.br/famup,PB,Prefeitura Municipal de Igaracy,igaracy
2506707,http://www.diariomunicipal.com.br/famup,PB,PREFEITURA MUNICIPAL DE IMACULADA,imaculada
2507002,http://www.diariomunicipal.com.br/famup,PB,PREFEITURA MUNICIPAL DE ITAPORANGA,itaporanga
2507309,http://www.diariomunicipal.com.br/famup,PB,Prefeitura Municipal de Jacaraú,jacarau
2513653,http://www.diariomunicipal.com.br/famup,PB,Prefeitura Municipal de Joca Claudino,joca claudino
2507705,http://www.diariomunicipal.com.br/famup,PB,PREFEITURA MUNICIPAL DE JUAZEIRINHO,juazeirinho
2507903,http://www.diariomunicipal.com.br/famup,PB,PREFEITURA MUNICIPAL DE JURIPIRANGA,juripiranga
2508554,http://www.diariomunicipal.com.br/famup,PB,PREFEITURA MUNICIPAL DE LOGRADOURO,logradouro
2508802,http://www.diariomunicipal.com.br/famup,PB,Prefeitura Municipal de Malta,malta
2509008,http://www.diariomunicipal.com.br/famup,PB,PREFEITURA MUNICIPAL DE MANAÍRA,manaira
2509156,http://www.diariomunicipal.com.br/famup,PB,PREFEITURA MUNICIPAL DE MARIZÓPOLIS,marizopolis
2509206,http://www.diariomunicipal.com.br/famup,PB,Prefeitura Municipal de Massaranduba,massaranduba
2509305,http://www.diariomunicipal.com.br/famup,PB,PREFEITURA MUNICIPAL DE MATARACA,mataraca
2509339,http://www.diariomunicipal.com.br/famup,PB,PREFEITURA MUNICIPAL DE MATINHAS,matinhas
2509503,http://www.diariomunicipal.com.br/famup,PB,PREFEITURA MUNICIPAL DE MONTADAS,montadas
2509602,http://www.diariomunicipal.com.br/famup,PB,PREFEITURA MUNICIPAL DE MONTE HOREBE,monte horebe
2509701,http://www.diariomunicipal.com.br/famup,PB,Prefeitura Municipal de Monteiro,monteiro
2509909,http://www.diariomunicipal.com.br/famup,PB,Prefeitura Municipal de Natuba,natuba
2510006,http://www.diariomunicipal.com.br/famup,PB,PREFEITURA MUNICIPAL DE NAZAREZINHO,nazarezinho
2510501,http://www.diariomunicipal.com.br/famup,PB,PREFEITURA MUNICIPAL DE OLIVEDOS,olivedos
2510600,http://www.diariomunicipal.com.br/famup,PB,PREFEITURA MUNICIPAL DE OURO VELHO,ouro velho
2510907,http://www.diariomunicipal.com.br/famup,PB,PREFEITURA MUNICIPAL DE PAULISTA,paulista
2511301,http://www.diariomunicipal.com.br/famup,PB,PREFEITURA MUNICIPAL DE PIANCÓ,pianco
2511400,http://www.diariomunicipal.com.br/famup,PB,PREFEITURA MUNICIPAL DE PICUÍ,picui
2511806,http://www.diariomunicipal.com.br/famup,PB,PREFEITURA MUNICIPAL DE PIRPIRITUBA,pirpirituba
2512002,http://www.diariomunicipal.com.br/famup,PB,Prefeitura Municipal de Pocinhos,pocinhos
2512036,http://www.diariomunicipal.com.br/famup,PB,Prefeitura Municipal de Poço Dantas,poco dantas
2512101,http://www.diariomunicipal.com.br/famup,PB,PREFEITURA MUNICIPAL DE POMBAL,pombal
2512309,http://www.diariomunicipal.com.br/famup,PB,Prefeitura Municipal de Princesa Isabel,princesa isabel
2512606,http://www.diariomunicipal.com.br/famup,PB,Prefeitura Municipal de Quixaba,quixaba
2512903,http://www.diariomunicipal.com.br/famup,PB,PREFEITURA MUNICIPAL DE RIO TINTO,rio tinto
2513158,http://www.diariomunicipal.com.br/famup,PB,PREFEITURA MUNICIPAL DE SANTA CECÍLIA,santa cecilia
2513604,http://www.diariomunicipal.com.br/famup,PB,Prefeitura Municipal de Santana dos Garrotes,santana garrotes
2513968,http://www.diariomunicipal.com.br/famup,PB,PREFEITURA MUNICIPAL DE SÃO DOMINGOS,sao domingos
2513984,http://www.diariomunicipal.com.br/famup,PB,Prefeitura Municipal de São Francisco,sao francisco
2514107,http://www.diariomunicipal.com.br/famup,PB,PREFEITURA MUNICIPAL DE SÃO JOÃO DO TIGRE,sao joao tigre
2514206,http://www.diariomunicipal.com.br/famup,PB,Prefeitura Municipal de São Jose da Lagoa Tapada,sao jose lagoa tapada
2514404,http://www.diariomunicipal.com.br/famup,PB,PREFEITURA MUNICIPAL DE SÃO JOSÉ DE ESPINHARAS,sao jose espinharas
2514651,http://www.diariomunicipal.com.br/famup,PB,PREFEITURA MUNICIPAL DE SÃO JOSÉ DO BREJO DO CRUZ,sao jose brejo cruz
2515005,http://www.diariomunicipal.com.br/famup,PB,PREFEITURA MUNICIPAL DE SÃO MIGUEL DE TAIPU,sao miguel taipu
2515104,http://www.diariomunicipal.com.br/famup,PB,PREFEITURA MUNICIPAL DE SÃO SEBASTIÃO DE LAGOA DE ROÇA,sao sebastiao lagoa roca
2515203,http://www.diariomunicipal.com.br/famup,PB,PREFEITURA MUNICIPAL DE SÃO SEBASTIÃO DO UMBUZEIRO,sao sebastiao umbuzeiro
2515302,http://www.diariomunicipal.com.br/famup,PB,PREFEITURA MUNICIPAL DE SAPÉ,sape
2515708,http://www.diariomunicipal.com.br/famup,PB,PREFEITURA MUNICIPAL DE SERRA GRANDE,serra grande
2516102,http://www.diariomunicipal.com.br/famup,PB,PREFEITURA MUNICIPAL DE SOLEDADE,soledade
2516607,http://www.diariomunicipal.com.br/famup,PB,PREFEITURA MUNICIPAL DE TAVARES,tavares
2516904,http://www.diariomunicipal.com.br/famup,PB,PREFEITURA MUNICIPAL DE UIRAUNA,uirauna
2517209,http://www.diariomunicipal.com.br/famup,PB,Prefeitura Municipal de Vieirópolis,vieiropolis
2607604,http://www.diariomunicipal.com.br/amupe,PE,Município da Ilha de Itamaracá,ilha itamaraca
2600054,http://www.diariomunicipal.com.br/amupe,PE,Município de Abreu e Lima,abreu e lima
2600104,http://www.diariomunicipal.com.br/amupe,PE,Município de Afogados da Ingazeira,afogados ingazeira
2600203,http://www.diariomunicipal.com.br/amupe,PE,Município de Afrânio,afranio
2600302,http://www.diariomunicipal.com.br/amupe,PE,Município de Agrestina,agrestina
2600401,http://www.diariomunicipal.com.br/amupe,PE,Município de Água Preta,agua preta
2600500,http://www.diariomunicipal.com.br/amupe,PE,Município de Águas Belas,aguas belas
2600609,http://www.diariomunicipal.com.br/amupe,PE,Município de Alagoinha,alagoinha
2600708,http://www.diariomunicipal.com.br/amupe,PE,Município de Aliança,alianca
2600807,http://www.diariomunicipal.com.br/amupe,PE,Município de Altinho,altinho
2600906,http://www.diariomunicipal.com.br/amupe,PE,Município de Amaraji,amaraji
2601003,http://www.diariomunicipal.com.br/amupe,PE,Município de Angelim,angelim
2601052,http://www.diariomunicipal.com.br/amupe,PE,Município de Araçoiaba,aracoiaba
2601102,http://www.diariomunicipal.com.br/amupe,PE,Município de Araripina,araripina
2601201,http://www.diariomunicipal.com.br/amupe,PE,Município de Arcoverde,arcoverde
2601300,http://www.diariomunicipal.com.br/amupe,PE,Município de Barra de Guabiraba,barra guabiraba
2601409,http://www.diariomunicipal.com.br/amupe,PE,Município de Barreiros,barreiros
2601508,http://www.diariomunicipal.com.br/amupe,PE,Município de Belém de Maria,belem maria
2601607,http://www.diariomunicipal.com.br/amupe,PE,Município de Belém do São Francisco,belem sao francisco
2601706,http://www.diariomunicipal.com.br/amupe,PE,Município de Belo Jardim,belo jardim
2601805,http://www.diariomunicipal.com.br/amupe,PE,Município de Betânia,betania
2601904,http://www.diariomunicipal.com.br/amupe,PE,Município de Bezerros,bezerros
2602001,http://www.diariomunicipal.com.br/amupe,PE,Município de Bodocó,bodoco
2602209,http://www.diariomunicipal.com.br/amupe,PE,Município de Bom Jardim,bom jardim
2602308,http://www.diariomunicipal.com.br/amupe,PE,Município de Bonito,bonito
2602407,http://www.diariomunicipal.com.br/amupe,PE,Município de Brejão,brejao
2602506,http://www.diariomunicipal.com.br/amupe,PE,Município de Brejinho,brejinho
2602605,http://www.diariomunicipal.com.br/amupe,PE,Município de Brejo da Madre de Deus,brejo madre deus
2602704,http://www.diariomunicipal.com.br/amupe,PE,Município de Buenos Aires,buenos aires
2602803,http://www.diariomunicipal.com.br/amupe,PE,Município de Buíque,buique
2602902,http://www.diariomunicipal.com.br/amupe,PE,Municipio de Cabo de Santo Agostinho,cabo santo agostinho
2603108,http://www.diariomunicipal.com.br/amupe,PE,Município de Cachoeirinha,cachoeirinha
2603207,http://www.diariomunicipal.com.br/amupe,PE,Município de Caetés,caetes
2603306,http://www.diariomunicipal.com.br/amupe,PE,Município de Calçado,calcado
2603405,http://www.diariomunicipal.com.br/amupe,PE,Município de Calumbi,calumbi
2603454,http://www.diariomunicipal.com.br/amupe,PE,Município de Camaragibe,camaragibe
2603504,http://www.diariomunicipal.com.br/amupe,PE,Município de Camocim de São Félix,camocim sao felix
2603603,http://www.diariomunicipal.com.br/amupe,PE,Município de Camutanga ,camutanga
2603702,http://www.diariomunicipal.com.br/amupe,PE,Município de Canhotinho,canhotinho
2603801,http://www.diariomunicipal.com.br/amupe,PE,Município de Capoeiras,capoeiras
2603900,http://www.diariomunicipal.com.br/amupe,PE,Município de Carnaiba,carnaiba
2603926,http://www.diariomunicipal.com.br/amupe,PE,Município de Carnaubeira da Penha,carnaubeira penha
2604007,http://www.diariomunicipal.com.br/amupe,PE,Município de Carpina,carpina
2604155,http://www.diariomunicipal.com.br/amupe,PE,Município de Casinhas,casinhas
2604205,http://www.diariomunicipal.com.br/amupe,PE,Município de Catende,catende
2604304,http://www.diariomunicipal.com.br/amupe,PE,Município de Cedro,cedro
2604403,http://www.diariomunicipal.com.br/amupe,PE,Município de Chã de Alegria,cha alegria
2604502,http://www.diariomunicipal.com.br/amupe,PE,Município de Chã Grande,cha grande
2604601,http://www.diariomunicipal.com.br/amupe,PE,Município de Condado,condado
2604700,http://www.diariomunicipal.com.br/amupe,PE,Município de Correntes,correntes
2604809,http://www.diariomunicipal.com.br/amupe,PE,Município de Cortês,cortes
2604908,http://www.diariomunicipal.com.br/amupe,PE,Município de Cumaru,cumaru
2605004,http://www.diariomunicipal.com.br/amupe,PE,Município de Cupira,cupira
2605103,http://www.diariomunicipal.com.br/amupe,PE,Município de Custódia,custodia
2605152,http://www.diariomunicipal.com.br/amupe,PE,Município de Dormentes,dormentes
2605202,http://www.diariomunicipal.com.br/amupe,PE,Município de Escada,escada
2605301,http://www.diariomunicipal.com.br/amupe,PE,Município de Exu,exu
2605400,http://www.diariomunicipal.com.br/amupe,PE,Município de Feira Nova,feira nova
2605509,http://www.diariomunicipal.com.br/amupe,PE,Município de Ferreiros,ferreiros
2605608,http://www.diariomunicipal.com.br/amupe,PE,Município de Flores,flores
2605707,http://www.diariomunicipal.com.br/amupe,PE,Município de Floresta,floresta
2605806,http://www.diariomunicipal.com.br/amupe,PE,Município de Frei Miguelinho,frei miguelinho
2605905,http://www.diariomunicipal.com.br/amupe,PE,Município de Gameleira,gameleira
2606002,http://www.diariomunicipal.com.br/amupe,PE,Município de Garanhuns,garanhuns
2606101,http://www.diariomunicipal.com.br/amupe,PE,Município de Glória do Goitá ,gloria goita
2606309,http://www.diariomunicipal.com.br/amupe,PE,Município de Granito,granito
2606408,http://www.diariomunicipal.com.br/amupe,PE,Município de Gravatá,gravata
2606507,http://www.diariomunicipal.com.br/amupe,PE,Município de Iati,iati
2606606,http://www.diariomunicipal.com.br/amupe,PE,Município de Ibimirim,ibimirim
2606705,http://www.diariomunicipal.com.br/amupe,PE,Município de Ibirajuba,ibirajuba
2606804,http://www.diariomunicipal.com.br/amupe,PE,Município de Igarassu,igarassu
2606903,http://www.diariomunicipal.com.br/amupe,PE,Município de Iguaracy,iguaracy
2607000,http://www.diariomunicipal.com.br/amupe,PE,Município de Inajá,inaja
2607109,http://www.diariomunicipal.com.br/amupe,PE,Município de Ingazeira,ingazeira
2607307,http://www.diariomunicipal.com.br/amupe,PE,Município de Ipubi,ipubi
2607406,http://www.diariomunicipal.com.br/amupe,PE,Município de Itacuruba,itacuruba
2607505,http://www.diariomunicipal.com.br/amupe,PE,Município de Itaíba,itaiba
2607703,http://www.diariomunicipal.com.br/amupe,PE,Município de Itapetim,itapetim
2607752,http://www.diariomunicipal.com.br/amupe,PE,Município de Itapissuma,itapissuma
2607802,http://www.diariomunicipal.com.br/amupe,PE,Município de Itaquitinga,itaquitinga
2607950,http://www.diariomunicipal.com.br/amupe,PE,Município de Jaqueira,jaqueira
2608008,http://www.diariomunicipal.com.br/amupe,PE,Município de Jataúba,jatauba
2608057,http://www.diariomunicipal.com.br/amupe,PE,Município de Jatobá,jatoba
2608107,http://www.diariomunicipal.com.br/amupe,PE,Município de João Alfredo,joao alfredo
2608206,http://www.diariomunicipal.com.br/amupe,PE,Município de Joaquim Nabuco,joaquim nabuco
2608255,http://www.diariomunicipal.com.br/amupe,PE,Município de Jucati,jucati
2608305,http://www.diariomunicipal.com.br/amupe,PE,Município de Jupi,jupi
2608404,http://www.diariomunicipal.com.br/amupe,PE,Município de Jurema,jurema
2608503,http://www.diariomunicipal.com.br/amupe,PE,Município de Lagoa de Itaenga,lagoa itaenga
2608453,http://www.diariomunicipal.com.br/amupe,PE,Município de Lagoa do Carro,lagoa carro
2608602,http://www.diariomunicipal.com.br/amupe,PE,Município de Lagoa do Ouro,lagoa ouro
2608701,http://www.diariomunicipal.com.br/amupe,PE,Município de Lagoa dos Gatos,lagoa gatos
2608750,http://www.diariomunicipal.com.br/amupe,PE,Município de Lagoa Grande,lagoa grande
2608800,http://www.diariomunicipal.com.br/amupe,PE,Município de Lajedo,lajedo
2608909,http://www.diariomunicipal.com.br/amupe,PE,Município de Limoeiro,limoeiro
2609006,http://www.diariomunicipal.com.br/amupe,PE,Município de Macaparana,macaparana
2609105,http://www.diariomunicipal.com.br/amupe,PE,Município de Machados,machados
2609154,http://www.diariomunicipal.com.br/amupe,PE,Município de Manari,manari
2609204,http://www.diariomunicipal.com.br/amupe,PE,Município de Maraial,maraial
2609303,http://www.diariomunicipal.com.br/amupe,PE,Município de Mirandiba,mirandiba
2614303,http://www.diariomunicipal.com.br/amupe,PE,Município de Moreilândia,moreilandia
2609402,http://www.diariomunicipal.com.br/amupe,PE,Município de Moreno,moreno
2609501,http://www.diariomunicipal.com.br/amupe,PE,Município de Nazaré da Mata,nazare mata
2609600,http://www.diariomunicipal.com.br/amupe,PE,Município de Olinda,olinda
2609709,http://www.diariomunicipal.com.br/amupe,PE,Município de Orobó,orobo
2609808,http://www.diariomunicipal.com.br/amupe,PE,Município de Orocó,oroco
2609907,http://www.diariomunicipal.com.br/amupe,PE,Município de Ouricuri,ouricuri
2610004,http://www.diariomunicipal.com.br/amupe,PE,Município de Palmares,palmares
2610103,http://www.diariomunicipal.com.br/amupe,PE,Município de Palmeirina,palmeirina
2610202,http://www.diariomunicipal.com.br/amupe,PE,Município de Panelas,panelas
2610301,http://www.diariomunicipal.com.br/amupe,PE,Município de Paranatama,paranatama
2610400,http://www.diariomunicipal.com.br/amupe,PE,Município de Parnamirim,parnamirim
2610509,http://www.diariomunicipal.com.br/amupe,PE,Município de Passira,passira
2610608,http://www.diariomunicipal.com.br/amupe,PE,Município de Paudalho,paudalho
2610806,http://www.diariomunicipal.com.br/amupe,PE,Município de Pedra,pedra
2610905,http://www.diariomunicipal.com.br/amupe,PE,Município de Pesqueira,pesqueira
2611002,http://www.diariomunicipal.com.br/amupe,PE,Município de Petrolândia,petrolandia
2611200,http://www.diariomunicipal.com.br/amupe,PE,Município de Poção,pocao
2611309,http://www.diariomunicipal.com.br/amupe,PE,Município de Pombos,pombos
2611408,http://www.diariomunicipal.com.br/amupe,PE,Município de Primavera,primavera
2611507,http://www.diariomunicipal.com.br/amupe,PE,Município de Quipapá,quipapa
2611533,http://www.diariomunicipal.com.br/amupe,PE,Município de Quixaba,quixaba
2611705,http://www.diariomunicipal.com.br/amupe,PE,Município de Riacho das Almas,riacho almas
2611804,http://www.diariomunicipal.com.br/amupe,PE,Município de Ribeirão,ribeirao
2611903,http://www.diariomunicipal.com.br/amupe,PE,Município de Rio Formoso,rio formoso
2612000,http://www.diariomunicipal.com.br/amupe,PE,Município de Sairé,saire
2612109,http://www.diariomunicipal.com.br/amupe,PE,Município de Salgadinho,salgadinho
2612208,http://www.diariomunicipal.com.br/amupe,PE,Município de Salgueiro,salgueiro
2612307,http://www.diariomunicipal.com.br/amupe,PE,Município de Saloá,saloa
2612406,http://www.diariomunicipal.com.br/amupe,PE,Município de Sanharó,sanharo
2612471,http://www.diariomunicipal.com.br/amupe,PE,Município de Santa Cruz da Baixa Verde,santa cruz baixa verde
2612505,http://www.diariomunicipal.com.br/amupe,PE,Município de Santa Cruz do Capibaribe,santa cruz capibaribe
2612554,http://www.diariomunicipal.com.br/amupe,PE,Município de Santa Filomena,santa filomena
2612604,http://www.diariomunicipal.com.br/amupe,PE,Município de Santa Maria da Boa Vista,santa maria boa vista
2612802,http://www.diariomunicipal.com.br/amupe,PE,Município de Santa Terezinha,santa terezinha
2612901,http://www.diariomunicipal.com.br/amupe,PE,Município de São Benedito do Sul,sao benedito sul
2613008,http://www.diariomunicipal.com.br/amupe,PE,Município de São Bento do Una,sao bento una
2613107,http://www.diariomunicipal.com.br/amupe,PE,Município de São Caetano,sao caetano
2613206,http://www.diariomunicipal.com.br/amupe,PE,Município de São João,sao joao
2613305,http://www.diariomunicipal.com.br/amupe,PE,Município de São Joaquim do Monte,sao joaquim monte
2613404,http://www.diariomunicipal.com.br/amupe,PE,Município de São José da Coroa Grande,sao jose coroa grande
2613503,http://www.diariomunicipal.com.br/amupe,PE,Município de São José do Belmonte,sao jose belmonte
2613602,http://www.diariomunicipal.com.br/amupe,PE,Município de São José do Egito,sao jose egito
2613701,http://www.diariomunicipal.com.br/amupe,PE,Município de São Lourenço da Mata,sao lourenco mata
2613800,http://www.diariomunicipal.com.br/amupe,PE,Município de São Vicente Férrer,sao vicente ferrer
2614006,http://www.diariomunicipal.com.br/amupe,PE,Município de Serrita,serrita
2614105,http://www.diariomunicipal.com.br/amupe,PE,Município de Sertânia,sertania
2614204,http://www.diariomunicipal.com.br/amupe,PE,Município de Sirinhaém,sirinhaem
2614402,http://www.diariomunicipal.com.br/amupe,PE,Município de Solidão,solidao
2614501,http://www.diariomunicipal.com.br/amupe,PE,Município de Surubim,surubim
2614600,http://www.diariomunicipal.com.br/amupe,PE,Município de Tabira,tabira
2614709,http://www.diariomunicipal.com.br/amupe,PE,Município de Tacaimbó,tacaimbo
2614808,http://www.diariomunicipal.com.br/amupe,PE,Município de Tacaratu,tacaratu
2614857,http://www.diariomunicipal.com.br/amupe,PE,Município de Tamandaré,tamandare
2615003,http://www.diariomunicipal.com.br/amupe,PE,Município de Taquaritinga do Norte,taquaritinga norte
2615102,http://www.diariomunicipal.com.br/amupe,PE,Município de Terezinha,terezinha
2615201,http://www.diariomunicipal.com.br/amupe,PE,Município de Terra Nova,terra nova
2615300,http://www.diariomunicipal.com.br/amupe,PE,Município de Timbaúba,timbauba
2615409,http://www.diariomunicipal.com.br/amupe,PE,Município de Toritama,toritama
2615508,http://www.diariomunicipal.com.br/amupe,PE,Município de Tracunhaém,tracunhaem
2615607,http://www.diariomunicipal.com.br/amupe,PE,Município de Trindade,trindade
2615706,http://www.diariomunicipal.com.br/amupe,PE,Município de Triunfo,triunfo
2615805,http://www.diariomunicipal.com.br/amupe,PE,Município de Tupanatinga,tupanatinga
2615904,http://www.diariomunicipal.com.br/amupe,PE,Município de Tuparetama,tuparetama
2616001,http://www.diariomunicipal.com.br/amupe,PE,Município de Venturosa,venturosa
2616100,http://www.diariomunicipal.com.br/amupe,PE,Município de Verdejante,verdejante
