territory_id,homepage,state_code,raw_publishing_entity,matched_territory_name
2700102,http://www.diariomunicipal.com.br/ama,AL,Prefeitura Municipal de Água Branca,agua branca
2700201,http://www.diariomunicipal.com.br/ama,AL,Prefeitura Municipal de Anadia,anadia
2700300,http://www.diariomunicipal.com.br/ama,AL,Prefeitura Municipal de Arapiraca,arapiraca
2700409,http://www.diariomunicipal.com.br/ama,AL,Prefeitura Municipal de Atalaia,atalaia
2700508,http://www.diariomunicipal.com.br/ama,AL,Prefeitura Municipal de Barra de Santo Antonio,barra santo antonio
2700607,http://www.diariomunicipal.com.br/ama,AL,Prefeitura Municipal de Barra de São Miguel,barra sao miguel
2700706,http://www.diariomunicipal.com.br/ama,AL,Prefeitura Municipal de Batalha,batalha
2700805,http://www.diariomunicipal.com.br/ama,AL,Prefeitura Municipal de Belém,belem
2700904,http://www.diariomunicipal.com.br/ama,AL,Prefeitura Municipal de Belo Monte,belo monte
2701001,http://www.diariomunicipal.com.br/ama,AL,Prefeitura Municipal de Boca da Mata,boca mata
2701100,http://www.diariomunicipal.com.br/ama,AL,Prefeitura Municipal de Branquinha,branquinha
2701209,http://www.diariomunicipal.com.br/ama,AL,Prefeitura Municipal de Cacimbinhas,cacimbinhas
2701308,http://www.diariomunicipal.com.br/ama,AL,Prefeitura Municipal de Cajueiro,cajueiro
2701357,http://www.diariomunicipal.com.br/ama,AL,Prefeitura Municipal de Campestre,campestre
2701407,http://www.diariomunicipal.com.br/ama,AL,Prefeitura Municipal de Campo Alegre,campo alegre
2701506,http://www.diariomunicipal.com.br/ama,AL,Prefeitura Municipal de Campo Grande,campo grande
2701605,http://www.diariomunicipal.com.br/ama,AL,Prefeitura Municipal de Canapi,canapi
2701704,http://www.diariomunicipal.com.br/ama,AL,Prefeitura Municipal de Capela,capela
2701803,http://www.diariomunicipal.com.br/ama,AL,Prefeitura Municipal de Carneiros,carneiros
2701902,http://www.diariomunicipal.com.br/ama,AL,Prefeitura Municipal de Chã Preta,cha preta
2702009,http://www.diariomunicipal.com.br/ama,AL,Prefeitura Municipal de Coité do Nóia,coite noia
2702108,http://www.diariomunicipal.com.br/ama,AL,Prefeitura Municipal de Colônia Leopoldina,colonia leopoldina
2702207,http://www.diariomunicipal.com.br/ama,AL,Prefeitura Municipal de Coqueiro Seco,coqueiro seco
2702306,http://www.diariomunicipal.com.br/ama,AL,Prefeitura Municipal de Coruripe,coruripe
2702355,http://www.diariomunicipal.com.br/ama,AL,Prefeitura Municipal de Craíbas,craibas
2702405,http://www.diariomunicipal.com.br/ama,AL,Prefeitura Municipal de Delmiro Gouveia,delmiro gouveia
2702504,http://www.diariomunicipal.com.br/ama,AL,Prefeitura Municipal de Dois Riachos,dois riachos
2702553,http://www.diariomunicipal.com.br/ama,AL,Prefeitura Municipal de Estrela de Alagoas,estrela alagoas
2702603,http://www.diariomunicipal.com.br/ama,AL,Prefeitura Municipal de Feira Grande,feira grande
2702702,http://www.diariomunicipal.com.br/ama,AL,Prefeitura Municipal de Feliz Deserto,feliz deserto
2702801,http://www.diariomunicipal.com.br/ama,AL,Prefeitura Municipal de Flexeiras,flexeiras
2702900,http://www.diariomunicipal.com.br/ama,AL,Prefeitura Municipal de Girau do Ponciano,girau ponciano
2703007,http://www.diariomunicipal.com.br/ama,AL,Prefeitura Municipal de Ibateguara,ibateguara
2703106,http://www.diariomunicipal.com.br/ama,AL,Prefeitura Municipal de Igaci,igaci
2703205,http://www.diariomunicipal.com.br/ama,AL,Prefeitura Municipal de Igreja Nova,igreja nova
2703304,http://www.diariomunicipal.com.br/ama,AL,Prefeitura Municipal de Inhapi,inhapi
2703403,http://www.diariomunicipal.com.br/ama,AL,Prefeitura Municipal de Jacaré dos Homens,jacare homens
2703502,http://www.diariomunicipal.com.br/ama,AL,Prefeitura Municipal de Jacuípe,jacuipe
2703601,http://www.diariomunicipal.com.br/ama,AL,Prefeitura Municipal de Japaratinga,japaratinga
2703700,http://www.diariomunicipal.com.br/ama,AL,Prefeitura Municipal de Jaramataia,jaramataia
2703759,http://www.diariomunicipal.com.br/ama,AL,Prefeitura Municipal de Jequiá da Praia,jequia praia
2703809,http://www.diariomunicipal.com.br/ama,AL,Prefeitura Municipal de Joaquim Gomes,joaquim gomes
2703908,http://www.diariomunicipal.com.br/ama,AL,Prefeitura Municipal de Jundiá,jundia
2704005,http://www.diariomunicipal.com.br/ama,AL,Prefeitura Municipal de Junqueiro,junqueiro
2704104,http://www.diariomunicipal.com.br/ama,AL,Prefeitura Municipal de Lagoa da Canoa,lagoa canoa
2704203,http://www.diariomunicipal.com.br/ama,AL,Prefeitura Municipal de Limoeiro de Anadia,limoeiro anadia
2704500,http://www.diariomunicipal.com.br/ama,AL,Prefeitura Municipal de Maragogi,maragogi
2704609,http://www.diariomunicipal.com.br/ama,AL,Prefeitura Municipal de Maravilha,maravilha
2704708,http://www.diariomunicipal.com.br/ama,AL,Prefeitura Municipal de Marechal Deodoro,marechal deodoro
2704807,http://www.diariomunicipal.com.br/ama,AL,Prefeitura Municipal de Maribondo,maribondo
2704906,http://www.diariomunicipal.com.br/ama,AL,Prefeitura Municipal de Mar Vermelho,mar vermelho
2705002,http://www.diariomunicipal.com.br/ama,AL,Prefeitura Municipal de Mata Grande,mata grande
2705200,http://www.diariomunicipal.com.br/ama,AL,Prefeitura Municipal de Messias,messias
2705309,http://www.diariomunicipal.com.br/ama,AL,Prefeitura Municipal de Minador do Negrão,minador negrao
2705408,http://www.diariomunicipal.com.br/ama,AL,Prefeitura Municipal de Monteirópolis,monteiropolis
2705507,http://www.diariomunicipal.com.br/ama,AL,Prefeitura Municipal de Murici,murici
2705606,http://www.diariomunicipal.com.br/ama,AL,Prefeitura Municipal de Novo Lino,novo lino
2705705,http://www.diariomunicipal.com.br/ama,AL,Prefeitura Municipal de Olho d'Água das Flores,olho agua flores
2705804,http://www.diariomunicipal.com.br/ama,AL,Prefeitura Municipal de Olho d´Agua do Casado,olho agua casado
2705903,http://www.diariomunicipal.com.br/ama,AL,Prefeitura Municipal de Olho D´Água Grande,olho agua grande
2706000,http://www.diariomunicipal.com.br/ama,AL,Prefeitura Municipal de Olivença,olivenca
2706109,http://www.diariomunicipal.com.br/ama,AL,Prefeitura Municipal de Ouro Branco,ouro branco
2706208,http://www.diariomunicipal.com.br/ama,AL,Prefeitura Municipal de Palestina,palestina
2706406,http://www.diariomunicipal.com.br/ama,AL,Prefeitura Municipal de Pão de Açúcar,pao acucar
2706422,http://www.diariomunicipal.com.br/ama,AL,Prefeitura Municipal de Pariconha,pariconha
2706505,http://www.diariomunicipal.com.br/ama,AL,Prefeitura Municipal de Passo de Camaragibe,passo camaragibe
2706604,http://www.diariomunicipal.com.br/ama,AL,Prefeitura Municipal de Paulo Jacinto,paulo jacinto
2706802,http://www.diariomunicipal.com.br/ama,AL,Prefeitura Municipal de Piaçabuçu,piacabucu
2706901,http://www.diariomunicipal.com.br/ama,AL,Prefeitura Municipal de Pilar,pilar
2707008,http://www.diariomunicipal.com.br/ama,AL,Prefeitura Municipal de Pindoba,pindoba
2707107,http://www.diariomunicipal.com.br/ama,AL,Prefeitura Municipal de Piranhas,piranhas
2707206,http://www.diariomunicipal.com.br/ama,AL,Prefeitura Municipal de Poço das Trincheiras,poco trincheiras
2707305,http://www.diariomunicipal.com.br/ama,AL,Prefeitura Municipal de Porto Calvo,porto calvo
2707404,http://www.diariomunicipal.com.br/ama,AL,Prefeitura Municipal de Porto de Pedras,porto pedras
2707503,http://www.diariomunicipal.com.br/ama,AL,Prefeitura Municipal de Porto Real do Colégio,porto real colegio
2707602,http://www.diariomunicipal.com.br/ama,AL,Prefeitura Municipal de Quebrangulo,quebrangulo
2707701,http://www.diariomunicipal.com.br/ama,AL,Prefeitura Municipal de Rio Largo,rio largo
2707800,http://www.diariomunicipal.com.br/ama,AL,Prefeitura Municipal de Roteiro,roteiro
2707909,http://www.diariomunicipal.com.br/ama,AL,Prefeitura Municipal de Santa Luzia do Norte,santa luzia norte
2708006,http://www.diariomunicipal.com.br/ama,AL,Prefeitura Municipal de Santana do Ipanema,santana ipanema
2708105,http://www.diariomunicipal.com.br/ama,AL,Prefeitura Municipal de Santana do Mundaú,santana mundau
2708303,http://www.diariomunicipal.com.br/ama,AL,Prefeitura Municipal de São José da Laje,sao jose laje
2708402,http://www.diariomunicipal.com.br/ama,AL,Prefeitura Municipal de São José da Tapera,sao jose tapera
2708501,http://www.diariomunicipal.com.br/ama,AL,Prefeitura Municipal de São Luis do Quitunde,sao luis quitunde
2708709,http://www.diariomunicipal.com.br/ama,AL,Prefeitura Municipal de São Miguel dos Milagres,sao miguel milagres
2708808,http://www.diariomunicipal.com.br/ama,AL,Prefeitura Municipal de São Sebastião,sao sebastiao
2708907,http://www.diariomunicipal.com.br/ama,AL,Prefeitura Municipal de Satuba,satuba
2708956,http://www.diariomunicipal.com.br/ama,AL,Prefeitura Municipal de Senador Rui Palmeira,senador rui palmeira
2709004,http://www.diariomunicipal.com.br/ama,AL,Prefeitura Municipal de Tanque D´Arca,tanque arca
2709103,http://www.diariomunicipal.com.br/ama,AL,Prefeitura Municipal de Taquarana,taquarana
2709152,http://www.diariomunicipal.com.br/ama,AL,Prefeitura Municipal de Teotonio Vilela,teotonio vilela
2709202,http://www.diariomunicipal.com.br/ama,AL,Prefeitura Municipal de Traipú,traipu
2709400,http://www.diariomunicipal.com.br/ama,AL,Prefeitura Municipal de Viçosa,vicosa
1300029,http://www.diariomunicipal.com.br/aam,AM,Município de Alvarães,alvaraes
1300060,http://www.diariomunicipal.com.br/aam,AM,Município de Amaturá,amatura
1300086,http://www.diariomunicipal.com.br/aam,AM,Município de Anamã,anama
1300102,http://www.diariomunicipal.com.br/aam,AM,Município de Anori,anori
1300144,http://www.diariomunicipal.com.br/aam,AM,Município de Apuí,apui
1300201,http://www.diariomunicipal.com.br/aam,AM,Município de Atalaia do Norte,atalaia norte
1300300,http://www.diariomunicipal.com.br/aam,AM,Município de Autazes,autazes
1300409,http://www.diariomunicipal.com.br/aam,AM,Município de Barcelos,barcelos
1300508,http://www.diariomunicipal.com.br/aam,AM,Município de Barreirinha,barreirinha
1300607,http://www.diariomunicipal.com.br/aam,AM,Município de Benjamin Constant,benjamin constant
1300631,http://www.diariomunicipal.com.br/aam,AM,Município de Beruri,beruri
1300680,http://www.diariomunicipal.com.br/aam,AM,Município de Boa Vista do Ramos,boa vista ramos
1300706,http://www.diariomunicipal.com.br/aam,AM,Município de Boca do Acre,boca acre
1300805,http://www.diariomunicipal.com.br/aam,AM,Município de Borba,borba
1300839,http://www.diariomunicipal.com.br/aam,AM,Município de Caapiranga,caapiranga
1300904,http://www.diariomunicipal.com.br/aam,AM,Município de Canutama,canutama
1301001,http://www.diariomunicipal.com.br/aam,AM,Município de Carauari,carauari
1301100,http://www.diariomunicipal.com.br/aam,AM,Município de Careiro,careiro
1301159,http://www.diariomunicipal.com.br/aam,AM,Município de Careiro da Várzea,careiro varzea
1301209,http://www.diariomunicipal.com.br/aam,AM,Município de Coari,coari
1301308,http://www.diariomunicipal.com.br/aam,AM,Município de Codajás,codajas
1301407,http://www.diariomunicipal.com.br/aam,AM,Município de Eirunepé,eirunepe
1301506,http://www.diariomunicipal.com.br/aam,AM,Município de Envira,envira
1301605,http://www.diariomunicipal.com.br/aam,AM,Município de Fonte Boa,fonte boa
1301654,http://www.diariomunicipal.com.br/aam,AM,Município de Guajará,guajara
1301704,http://www.diariomunicipal.com.br/aam,AM,Município de Humaitá,humaita
1301803,http://www.diariomunicipal.com.br/aam,AM,Município de Ipixuna,ipixuna
1301852,http://www.diariomunicipal.com.br/aam,AM,Município de Iranduba,iranduba
1301902,http://www.diariomunicipal.com.br/aam,AM,Município de Itacoatiara,itacoatiara
1301951,http://www.diariomunicipal.com.br/aam,AM,Município de Itamarati,itamarati
1302009,http://www.diariomunicipal.com.br/aam,AM,Município de Itapiranga,itapiranga
1302108,http://www.diariomunicipal.com.br/aam,AM,Município de Japurá,japura
1302207,http://www.diariomunicipal.com.br/aam,AM,Município de Juruá,jurua
1302306,http://www.diariomunicipal.com.br/aam,AM,Município de Jutaí,jutai
1302405,http://www.diariomunicipal.com.br/aam,AM,Município de Lábrea,labrea
1302504,http://www.diariomunicipal.com.br/aam,AM,Município de Manacapuru,manacapuru
1302553,http://www.diariomunicipal.com.br/aam,AM,Município de Manaquiri,manaquiri
1302702,http://www.diariomunicipal.com.br/aam,AM,Município de Manicoré,manicore
1302801,http://www.diariomunicipal.com.br/aam,AM,Município de Maraã,maraa
1302900,http://www.diariomunicipal.com.br/aam,AM,Município de Maués,maues
1303007,http://www.diariomunicipal.com.br/aam,AM,Município de Nhamundá,nhamunda
1303106,http://www.diariomunicipal.com.br/aam,AM,Município de Nova Olinda do Norte,nova olinda norte
1303205,http://www.diariomunicipal.com.br/aam,AM,Município de Novo Airão,novo airao
1303304,http://www.diariomunicipal.com.br/aam,AM,Município de Novo Aripuanã,novo aripuana
1303403,http://www.diariomunicipal.com.br/aam,AM,Município de Parintins,parintins
1303502,http://www.diariomunicipal.com.br/aam,AM,Município de Pauini,pauini
1303536,http://www.diariomunicipal.com.br/aam,AM,Município de Presidente Figueiredo,presidente figueiredo
1303569,http://www.diariomunicipal.com.br/aam,AM,Município de Rio Preto da Eva,rio preto eva
1303601,http://www.diariomunicipal.com.br/aam,AM,Município de Santa Isabel do Rio Negro,santa isabel rio negro
1303700,http://www.diariomunicipal.com.br/aam,AM,Município de Santo Antônio do Içá,santo antonio ica
1303809,http://www.diariomunicipal.com.br/aam,AM,Município de São Gabriel da Cachoeira,sao gabriel cachoeira
1303908,http://www.diariomunicipal.com.br/aam,AM,Município de São Paulo de Olivença,sao paulo olivenca
1303957,http://www.diariomunicipal.com.br/aam,AM,Município de São Sebastião do Uatumã,sao sebastiao uatuma
1304005,http://www.diariomunicipal.com.br/aam,AM,Município de Silves,silves
1304062,http://www.diariomunicipal.com.br/aam,AM,Município de Tabatinga,tabatinga
1304104,http://www.diariomunicipal.com.br/aam,AM,Município de Tapauá,tapaua
1304203,http://www.diariomunicipal.com.br/aam,AM,Município de Tefé,tefe
1304237,http://www.diariomunicipal.com.br/aam,AM,Município de Tonantins,tonantins
1304260,http://www.diariomunicipal.com.br/aam,AM,Município de Uarini,uarini
1304302,http://www.diariomunicipal.com.br/aam,AM,Município de Urucará,urucara
1304401,http://www.diariomunicipal.com.br/aam,AM,Município de Urucurituba,urucurituba
2900900,http://www.diariomunicipal.com.br/amurc,BA,Prefeitura Municipal de Almadina,almadina
2902252,http://www.diariomunicipal.com.br/amurc,BA,Prefeitura Municipal de Arataca,arataca
2902401,http://www.diariomunicipal.com.br/amurc,BA,Prefeitura Municipal de Aurelino Leal,aurelino leal
2903102,http://www.diariomunicipal.com.br/amurc,BA,Prefeitura Municipal de Barra do Rocha,barra rocha
2908002,http://www.diariomunicipal.com.br/amurc,BA,Prefeitura Municipal de Coaraci,coaraci
2910909,http://www.diariomunicipal.com.br/amurc,BA,Prefeitura Municipal de Firmino Alves,firmino alves
2912103,http://www.diariomunicipal.com.br/amurc,BA,Prefeitura Municipal de Ibicaraí,ibicarai
2912301,http://www.diariomunicipal.com.br/amurc,BA,Prefeitura Municipal de Ibicuí,ibicui
2914901,http://www.diariomunicipal.com.br/amurc,BA,Prefeitura Municipal de Itacaré,itacare
2916203,http://www.diariomunicipal.com.br/amurc,BA,Prefeitura Municipal de Itapé,itape
2917102,http://www.diariomunicipal.com.br/amurc,BA,Prefeitura Municipal de Itororó,itororo
2918555,http://www.diariomunicipal.com.br/amurc,BA,Prefeitura Municipal de Jussari,jussari
2920908,http://www.diariomunicipal.com.br/amurc,BA,Prefeitura Municipal de Mascote,mascote
2932309,http://www.diariomunicipal.com.br/amurc,BA,Prefeitura Municipal de Ubatã,ubata
2932705,http://www.diariomunicipal.com.br/amurc,BA,Prefeitura Municipal de Uruçuca,urucuca
2300101,http://www.diariomunicipal.com.br/aprece,CE,Prefeitura Municipal de Abaiara,abaiara
2300309,http://www.diariomunicipal.com.br/aprece,CE,Prefeitura Municipal de Acopiara,acopiara
2300408,http://www.diariomunicipal.com.br/aprece,CE,Prefeitura Municipal de Aiuaba,aiuaba
2300507,http://www.diariomunicipal.com.br/aprece,CE,Prefeitura Municipal de Alcântaras,alcantaras
2300606,http://www.diariomunicipal.com.br/aprece,CE,Prefeitura Municipal de Altaneira,altaneira
2300705,http://www.diariomunicipal.com.br/aprece,CE,PREFEITURA MUNICIPAL DE ALTO SANTO ,alto santo
2300804,http://www.diariomunicipal.com.br/aprece,CE,Prefeitura Municipal de Antonina do Norte,antonina norte
2301208,http://www.diariomunicipal.com.br/aprece,CE,Prefeitura Municipal de Aracoiaba,aracoiaba
2301257,http://www.diariomunicipal.com.br/aprece,CE,Prefeitura Municipal de Ararendá,ararenda
2301307,http://www.diariomunicipal.com.br/aprece,CE,Prefeitura Municipal de Araripe,araripe
2301406,http://www.diariomunicipal.com.br/aprece,CE,Prefeitura Municipal de Aratuba,aratuba
2301505,http://www.diariomunicipal.com.br/aprece,CE,Prefeitura Municipal de Arneiroz,arneiroz
2301604,http://www.diariomunicipal.com.br/aprece,CE,Prefeitura Municipal de Assaré,assare
2301851,http://www.diariomunicipal.com.br/aprece,CE,Prefeitura Municipal de Banabuiú,banabuiu
2301901,http://www.diariomunicipal.com.br/aprece,CE,Prefeitura Municipal de Barbalha,barbalha
2302008,http://www.diariomunicipal.com.br/aprece,CE,Prefeitura Municipal de Barro,barro
2302057,http://www.diariomunicipal.com.br/aprece,CE,Prefeitura Municipal de Barroquinha,barroquinha
2302107,http://www.diariomunicipal.com.br/aprece,CE,Prefeitura Municipal de Baturité,baturite
2302503,http://www.diariomunicipal.com.br/aprece,CE,Prefeitura Municipal de Brejo Santo,brejo santo
2303105,http://www.diariomunicipal.com.br/aprece,CE,Prefeitura Municipal de Cariré,carire
2303303,http://www.diariomunicipal.com.br/aprece,CE,Prefeitura Municipal de Cariús,carius
2303659,http://www.diariomunicipal.com.br/aprece,CE,Prefeitura Municipal de Catunda,catunda
2303808,http://www.diariomunicipal.com.br/aprece,CE,Prefeitura Municipal de Cedro,cedro
2303907,http://www.diariomunicipal.com.br/aprece,CE,Prefeitura Municipal de Chaval,chaval
2303956,http://www.diariomunicipal.com.br/aprece,CE,Prefeitura Municipal de Chorozinho,chorozinho
2304004,http://www.diariomunicipal.com.br/aprece,CE,Prefeitura Municipal de Coreaú,coreau
2304103,http://www.diariomunicipal.com.br/aprece,CE,Prefeitura Municipal de Crateús,crateus
2304236,http://www.diariomunicipal.com.br/aprece,CE,Prefeitura Municipal de Croatá,croata
2304277,http://www.diariomunicipal.com.br/aprece,CE,Prefeitura Municipal de Ereré,erere
2304301,http://www.diariomunicipal.com.br/aprece,CE,Prefeitura Municipal de Farias Brito,farias brito
2304459,http://www.diariomunicipal.com.br/aprece,CE,Prefeitura Municipal de Fortim,fortim
2304509,http://www.diariomunicipal.com.br/aprece,CE,Prefeitura Municipal de Frecheirinha,frecheirinha
2304608,http://www.diariomunicipal.com.br/aprece,CE,Prefeitura Municipal de General Sampaio,general sampaio
2304905,http://www.diariomunicipal.com.br/aprece,CE,Prefeitura Municipal de Groaíras,groairas
2305001,http://www.diariomunicipal.com.br/aprece,CE,Prefeitura Municipal de Guaraciaba do Norte,guaraciaba norte
2305209,http://www.diariomunicipal.com.br/aprece,CE,PREFEITURA MUNICIPAL DE HIDROLÂNDIA,hidrolandia
2305266,http://www.diariomunicipal.com.br/aprece,CE,Prefeitura Municipal de Ibaretama,ibaretama
2305308,http://www.diariomunicipal.com.br/aprece,CE,Prefeitura Municipal de Ibiapina,ibiapina
2305332,http://www.diariomunicipal.com.br/aprece,CE,Prefeitura Municipal de Ibicuitinga,ibicuitinga
2305357,http://www.diariomunicipal.com.br/aprece,CE,Prefeitura Municipal de Icapuí,icapui
2305407,http://www.diariomunicipal.com.br/aprece,CE,Prefeitura Municipal de Icó,ico
2305506,http://www.diariomunicipal.com.br/aprece,CE,Prefeitura Municipal de Iguatu,iguatu
2305605,http://www.diariomunicipal.com.br/aprece,CE,Prefeitura Municipal de Independência,independencia
2305654,http://www.diariomunicipal.com.br/aprece,CE,Prefeitura Municipal de Ipaporanga,ipaporanga
2305704,http://www.diariomunicipal.com.br/aprece,CE,Prefeitura Municipal de Ipaumirim,ipaumirim
2306009,http://www.diariomunicipal.com.br/aprece,CE,Prefeitura Municipal de Iracema,iracema
2306108,http://www.diariomunicipal.com.br/aprece,CE,Prefeitura Municipal de Irauçuba,iraucuba
2306207,http://www.diariomunicipal.com.br/aprece,CE,Prefeitura Municipal de Itaiçaba,itaicaba
2306256,http://www.diariomunicipal.com.br/aprece,CE,Prefeitura Municipal de Itaitinga,itaitinga
2306504,http://www.diariomunicipal.com.br/aprece,CE,Prefeitura Municipal de Itapiúna,itapiuna
2306702,http://www.diariomunicipal.com.br/aprece,CE,Prefeitura Municipal de Jaguaretama,jaguaretama
2307106,http://www.diariomunicipal.com.br/aprece,CE,Prefeitura Municipal de Jardim,jardim
2307205,http://www.diariomunicipal.com.br/aprece,CE,Prefeitura Municipal de Jati,jati
2307403,http://www.diariomunicipal.com.br/aprece,CE,Prefeitura Municipal de Jucás,jucas
2307601,http://www.diariomunicipal.com.br/aprece,CE,Prefeitura Municipal de Limoeiro do Norte,limoeiro norte
2307635,http://www.diariomunicipal.com.br/aprece,CE,Prefeitura Municipal de Madalena,madalena
2307908,http://www.diariomunicipal.com.br/aprece,CE,Prefeitura Municipal de Martinópole,martinopole
2308005,http://www.diariomunicipal.com.br/aprece,CE,Prefeitura Municipal de Massapê,massape
2308104,http://www.diariomunicipal.com.br/aprece,CE,Prefeitura Municipal de Mauriti,mauriti
2308203,http://www.diariomunicipal.com.br/aprece,CE,Prefeitura Municipal de Meruoca,meruoca
2308302,http://www.diariomunicipal.com.br/aprece,CE,Prefeitura Municipal de Milagres,milagres
2308500,http://www.diariomunicipal.com.br/aprece,CE,Prefeitura Municipal de Mombaça,mombaca
2308708,http://www.diariomunicipal.com.br/aprece,CE,Prefeitura Municipal de Morada Nova,morada nova
2309201,http://www.diariomunicipal.com.br/aprece,CE,Prefeitura Municipal de Nova Olinda,nova olinda
2309300,http://www.diariomunicipal.com.br/aprece,CE,Prefeitura Municipal de Nova Russas,nova russas
2309508,http://www.diariomunicipal.com.br/aprece,CE,Prefeitura Municipal de Orós,oros
2309805,http://www.diariomunicipal.com.br/aprece,CE,Prefeitura Municipal de Pacoti,pacoti
2309904,http://www.diariomunicipal.com.br/aprece,CE,Prefeitura Municipal de Pacujá,pacuja
2310001,http://www.diariomunicipal.com.br/aprece,CE,Prefeitura Municipal de Palhano,palhano
2310407,http://www.diariomunicipal.com.br/aprece,CE,Prefeitura Municipal de Paramoti,paramoti
2310605,http://www.diariomunicipal.com.br/aprece,CE,Prefeitura Municipal de Penaforte,penaforte
2310852,http://www.diariomunicipal.com.br/aprece,CE,Prefeitura Municipal de Pindoretama,pindoretama
2310902,http://www.diariomunicipal.com.br/aprece,CE,Prefeitura Municipal de Piquet Carneiro,piquet carneiro
2311108,http://www.diariomunicipal.com.br/aprece,CE,Prefeitura Municipal de Porteiras,porteiras
2311207,http://www.diariomunicipal.com.br/aprece,CE,Prefeitura Municipal de Potengi,potengi
2311231,http://www.diariomunicipal.com.br/aprece,CE,Prefeitura Municipal de Potiretama,potiretama
2311264,http://www.diariomunicipal.com.br/aprece,CE,Prefeitura Municipal de Quiterianópolis,quiterianopolis
2311306,http://www.diariomunicipal.com.br/aprece,CE,Prefeitura Municipal de Quixadá,quixada
2311355,http://www.diariomunicipal.com.br/aprece,CE,Prefeitura Municipal de Quixelô,quixelo
2311405,http://www.diariomunicipal.com.br/aprece,CE,Prefeitura Municipal de Quixeramobim,quixeramobim
2311504,http://www.diariomunicipal.com.br/aprece,CE,Prefeitura Municipal de Quixeré,quixere
2311900,http://www.diariomunicipal.com.br/aprece,CE,Prefeitura Municipal de Saboeiro,saboeiro
2311959,http://www.diariomunicipal.com.br/aprece,CE,Prefeitura Municipal de Salitre,salitre
2312106,http://www.diariomunicipal.com.br/aprece,CE,Prefeitura Municipal de Santana do Cariri,santana cariri
2312205,http://www.diariomunicipal.com.br/aprece,CE,Prefeitura Municipal de Santa Quitéria,santa quiteria
2312304,http://www.diariomunicipal.com.br/aprece,CE,Prefeitura Municipal de São Benedito,sao benedito
2312700,http://www.diariomunicipal.com.br/aprece,CE,Prefeitura Municipal de Senador Pompeu,senador pompeu
2313005,http://www.diariomunicipal.com.br/aprece,CE,Prefeitura Municipal de Solonópole,solonopole
2313104,http://www.diariomunicipal.com.br/aprece,CE,Prefeitura Municipal de Tabuleiro do Norte,tabuleiro norte
2313302,http://www.diariomunicipal.com.br/aprece,CE,Prefeitura Municipal de Tauá,taua
2313609,http://www.diariomunicipal.com.br/aprece,CE,Prefeitura Municipal de Ubajara,ubajara
2313708,http://www.diariomunicipal.com.br/aprece,CE,Prefeitura Municipal de Umari,umari
2313906,http://www.diariomunicipal.com.br/aprece,CE,Prefeitura Municipal de Uruoca,uruoca
2314003,http://www.diariomunicipal.com.br/aprece,CE,Prefeitura Municipal de Várzea Alegre,varzea alegre
2314102,http://www.diariomunicipal.com.br/aprece,CE,Prefeitura Municipal de Viçosa do Ceará,vicosa ceara
5200050,http://www.diariomunicipal.com.br/agm,GO,Município de Abadia ,abadia goias
5200134,http://www.diariomunicipal.com.br/agm,GO,Município de Acreúna,acreuna
5200159,http://www.diariomunicipal.com.br/agm,GO,Município de Adelândia,adelandia
5200175,http://www.diariomunicipal.com.br/agm,GO,Município de Água Fria de Goiás,agua fria goias
5200258,http://www.diariomunicipal.com.br/agm,GO,Município de Águas Lindas de Goiás,aguas lindas goias
5200308,http://www.diariomunicipal.com.br/agm,GO,Município de Alexânia,alexania
5200555,http://www.diariomunicipal.com.br/agm,GO,Município de Alto Horizonte,alto horizonte
5200803,http://www.diariomunicipal.com.br/agm,GO,Município de Alvorada do Norte,alvorada norte
