territory_id,homepage,state_code,raw_publishing_entity,matched_territory_name
2616183,http://www.diariomunicipal.com.br/amupe,PE,Município de Vertente do Lério,vertente lerio
2616308,http://www.diariomunicipal.com.br/amupe,PE,Município de Vicência,vicencia
2616407,http://www.diariomunicipal.com.br/amupe,PE,Município de Vitória de Santo Antão,vitoria santo antao
2616506,http://www.diariomunicipal.com.br/amupe,PE,Município de Xexéu,xexeu
2610707,http://www.diariomunicipal.com.br/amupe,PE,Município do Paulista,paulista
2200202,http://www.diariomunicipal.com.br/appm,PI,Município de Água Branca,agua branca
2200459,http://www.diariomunicipal.com.br/appm,PI,Município de Alvorada do Gurguéia,alvorada gurgueia
2201150,http://www.diariomunicipal.com.br/appm,PI,Município de Baixa Grande do Ribeiro,baixa grande ribeiro
2201176,http://www.diariomunicipal.com.br/appm,PI,Município de Barra D` Alcântara,barra alcantara
2201408,http://www.diariomunicipal.com.br/appm,PI,Município de Barro Duro,barro duro
2201705,http://www.diariomunicipal.com.br/appm,PI,Município de Bertolínia,bertolinia
2201929,http://www.diariomunicipal.com.br/appm,PI,Município de Bonfim do Piauí,bonfim piaui
2201945,http://www.diariomunicipal.com.br/appm,PI,Município de Boqueirão do Piauí,boqueirao piaui
2202778,http://www.diariomunicipal.com.br/appm,PI,Município de Colônia do Piauí,colonia piaui
2202851,http://www.diariomunicipal.com.br/appm,PI,Município de Coronel José Dias,coronel jose dias
2203305,http://www.diariomunicipal.com.br/appm,PI,Município de Demerval Lobão,demerval lobao
2203354,http://www.diariomunicipal.com.br/appm,PI,Município de Dirceu Arcoverde,dirceu arcoverde
2203800,http://www.diariomunicipal.com.br/appm,PI,Município de Flores do Piauí,flores piaui
2204501,http://www.diariomunicipal.com.br/appm,PI,Município de Guadalupe,guadalupe
2205003,http://www.diariomunicipal.com.br/appm,PI,Município de Itainópolis,itainopolis
2205102,http://www.diariomunicipal.com.br/appm,PI,Município de Itaueira,itaueira
2205458,http://www.diariomunicipal.com.br/appm,PI,Município de Joca Marques,joca marques
2205524,http://www.diariomunicipal.com.br/appm,PI,Município de Júlio Borges,julio borges
2205599,http://www.diariomunicipal.com.br/appm,PI,Município de Lagoa do Sitio,lagoa sitio
2205607,http://www.diariomunicipal.com.br/appm,PI,Município de Landri Sales,landri sales
2206407,http://www.diariomunicipal.com.br/appm,PI,Município de Monsenhor Gil,monsenhor gil
2206696,http://www.diariomunicipal.com.br/appm,PI,Município de Murici dos Portelas,murici portelas
2207850,http://www.diariomunicipal.com.br/appm,PI,Município de Pavussú,pavussu
2208106,http://www.diariomunicipal.com.br/appm,PI,Município de Pimenteiras,pimenteiras
2208601,http://www.diariomunicipal.com.br/appm,PI,Município de Prata do Piauí,prata piaui
2209005,http://www.diariomunicipal.com.br/appm,PI,Município de Rio Grande do Piauí,rio grande piaui
2209500,http://www.diariomunicipal.com.br/appm,PI,Município de Santo Inacio do Piauí,santo inacio piaui
2210003,http://www.diariomunicipal.com.br/appm,PI,Município de São João do Piauí,sao joao piaui
2210623,http://www.diariomunicipal.com.br/appm,PI,Município de Sebastião Barros,sebastiao barros
2210805,http://www.diariomunicipal.com.br/appm,PI,Município de Simplício Mendes,simplicio mendes
2210904,http://www.diariomunicipal.com.br/appm,PI,Município de Socorro do Piauí,socorro piaui
2211605,http://www.diariomunicipal.com.br/appm,PI,Município de Vila Nova do Piauí,vila nova piaui
4106555,http://www.diariomunicipal.com.br/amp,PR,Município de Corumbataí do Sul,corumbatai sul
4107405,http://www.diariomunicipal.com.br/amp,PR,MUNICIPIO DE ENÉAS MARQUES,eneas marques
4107702,http://www.diariomunicipal.com.br/amp,PR,Município de Fênix,fenix
4116406,http://www.diariomunicipal.com.br/amp,PR,Município de Nossa Senhora das Graças,nossa senhora gracas
4126256,http://www.diariomunicipal.com.br/amp,PR,Município de Sarandi,sarandi
4126272,http://www.diariomunicipal.com.br/amp,PR,MUNICÍPIO DE SAUDADE DO IGUAÇU,saudade iguacu
4100103,http://www.diariomunicipal.com.br/amp,PR,Prefeitura Municipal de Abatiá,abatia
4100202,http://www.diariomunicipal.com.br/amp,PR,Prefeitura Municipal de Adrianópolis,adrianopolis
4100301,http://www.diariomunicipal.com.br/amp,PR,Prefeitura Municipal de Agudos do Sul,agudos sul
4100400,http://www.diariomunicipal.com.br/amp,PR,Prefeitura Municipal de Almirante Tamandaré,almirante tamandare
4100459,http://www.diariomunicipal.com.br/amp,PR,Prefeitura Municipal de Altamira do Paraná,altamira parana
4100905,http://www.diariomunicipal.com.br/amp,PR,Prefeitura Municipal de Amaporã,amapora
4101002,http://www.diariomunicipal.com.br/amp,PR,Prefeitura Municipal de Ampére,ampere
4101051,http://www.diariomunicipal.com.br/amp,PR,Prefeitura Municipal de Anahy,anahy
4101101,http://www.diariomunicipal.com.br/amp,PR,Prefeitura Municipal de Andirá,andira
4101200,http://www.diariomunicipal.com.br/amp,PR,Prefeitura Municipal de Antonina,antonina
4102109,http://www.diariomunicipal.com.br/amp,PR,Prefeitura Municipal de Astorga,astorga
4102208,http://www.diariomunicipal.com.br/amp,PR,Prefeitura Municipal de Atalaia,atalaia
4102307,http://www.diariomunicipal.com.br/amp,PR,Prefeitura Municipal de Balsa Nova,balsa nova
4102406,http://www.diariomunicipal.com.br/amp,PR,Prefeitura Municipal de Bandeirantes,bandeirantes
4102505,http://www.diariomunicipal.com.br/amp,PR,Prefeitura Municipal de Barbosa Ferraz,barbosa ferraz
4102703,http://www.diariomunicipal.com.br/amp,PR,Prefeitura Municipal de Barra do Jacaré,barra jacare
4102752,http://www.diariomunicipal.com.br/amp,PR,Prefeitura Municipal de Bela Vista da Caroba,bela vista caroba
4102901,http://www.diariomunicipal.com.br/amp,PR,Prefeitura Municipal de Bituruna,bituruna
4103040,http://www.diariomunicipal.com.br/amp,PR,Prefeitura Municipal de Boa Ventura de São Roque,boa ventura sao roque
4103057,http://www.diariomunicipal.com.br/amp,PR,Prefeitura Municipal de Boa Vista da Aparecida,boa vista aparecida
4103107,http://www.diariomunicipal.com.br/amp,PR,Prefeitura Municipal de Bocaiúva do Sul,bocaiuva sul
4103156,http://www.diariomunicipal.com.br/amp,PR,Prefeitura Municipal de Bom Jesus do Sul,bom jesus sul
4103206,http://www.diariomunicipal.com.br/amp,PR,Prefeitura Municipal de Bom Sucesso,bom sucesso
4103222,http://www.diariomunicipal.com.br/amp,PR,Prefeitura Municipal de Bom Sucesso do Sul,bom sucesso sul
4103354,http://www.diariomunicipal.com.br/amp,PR,Prefeitura Municipal de Braganey,braganey
4103404,http://www.diariomunicipal.com.br/amp,PR,Prefeitura Municipal de Cafeara,cafeara
4103453,http://www.diariomunicipal.com.br/amp,PR,Prefeitura Municipal de Cafelândia,cafelandia
4103503,http://www.diariomunicipal.com.br/amp,PR,Prefeitura Municipal de Califórnia,california
4103958,http://www.diariomunicipal.com.br/amp,PR,Prefeitura Municipal de Campina do Simão,campina simao
4104006,http://www.diariomunicipal.com.br/amp,PR,Prefeitura Municipal de Campina Grande do Sul,campina grande sul
4104105,http://www.diariomunicipal.com.br/amp,PR,Prefeitura Municipal de Campo do Tenente,campo tenente
4104253,http://www.diariomunicipal.com.br/amp,PR,Prefeitura Municipal de Campo Magro,campo magro
4104428,http://www.diariomunicipal.com.br/amp,PR,Prefeitura Municipal de Candói,candoi
4104451,http://www.diariomunicipal.com.br/amp,PR,Prefeitura Municipal de Cantagalo,cantagalo
4104600,http://www.diariomunicipal.com.br/amp,PR,Prefeitura Municipal de Capitão Leônidas Marques,capitao leonidas marques
4104709,http://www.diariomunicipal.com.br/amp,PR,Prefeitura Municipal de Carlópolis,carlopolis
4105003,http://www.diariomunicipal.com.br/amp,PR,Prefeitura Municipal de Catanduvas,catanduvas
4105102,http://www.diariomunicipal.com.br/amp,PR,PREFEITURA MUNICIPAL DE CENTENÁRIO DO SUL,centenario sul
4105201,http://www.diariomunicipal.com.br/amp,PR,Prefeitura Municipal de Cerro Azul,cerro azul
4105409,http://www.diariomunicipal.com.br/amp,PR,Prefeitura Municipal de Chopinzinho,chopinzinho
4105805,http://www.diariomunicipal.com.br/amp,PR,Prefeitura Municipal de Colombo,colombo
4105904,http://www.diariomunicipal.com.br/amp,PR,Prefeitura Municipal de Colorado,colorado
4106209,http://www.diariomunicipal.com.br/amp,PR,Prefeitura Municipal de Contenda,contenda
4106506,http://www.diariomunicipal.com.br/amp,PR,Prefeitura Municipal de Coronel Vivida,coronel vivida
4107157,http://www.diariomunicipal.com.br/amp,PR,Prefeitura Municipal de Diamante D'Oeste,diamante oeste
4107207,http://www.diariomunicipal.com.br/amp,PR,Prefeitura Municipal de Dois Vizinhos,dois vizinhos
4128633,http://www.diariomunicipal.com.br/amp,PR,Prefeitura Municipal de Doutor Ulysses,doutor ulysses
4107736,http://www.diariomunicipal.com.br/amp,PR,Prefeitura Municipal de Fernandes Pinheiro,fernandes pinheiro
4107850,http://www.diariomunicipal.com.br/amp,PR,Prefeitura Municipal de Flor da Serra do Sul,flor serra sul
4108106,http://www.diariomunicipal.com.br/amp,PR,Prefeitura Municipal de Flórida,florida
4108403,http://www.diariomunicipal.com.br/amp,PR,Prefeitura Municipal de Francisco Beltrão,francisco beltrao
4108502,http://www.diariomunicipal.com.br/amp,PR,Prefeitura Municipal de General Carneiro,general carneiro
4108601,http://www.diariomunicipal.com.br/amp,PR,Prefeitura Municipal de Goioerê,goioere
4108650,http://www.diariomunicipal.com.br/amp,PR,Prefeitura Municipal de Goioxim,goioxim
4108809,http://www.diariomunicipal.com.br/amp,PR,Prefeitura Municipal de Guaira,guaira
4108957,http://www.diariomunicipal.com.br/amp,PR,Prefeitura Municipal de Guamiranga,guamiranga
4109203,http://www.diariomunicipal.com.br/amp,PR,Prefeitura Municipal de Guaraci,guaraci
4109302,http://www.diariomunicipal.com.br/amp,PR,Prefeitura Municipal de Guaraniaçu,guaraniacu
4109500,http://www.diariomunicipal.com.br/amp,PR,Prefeitura Municipal de Guaraqueçaba,guaraquecaba
4109658,http://www.diariomunicipal.com.br/amp,PR,Prefeitura Municipal de Honório Serpa,honorio serpa
4110003,http://www.diariomunicipal.com.br/amp,PR,Prefeitura Municipal de Iguaraçu,iguaracu
4110052,http://www.diariomunicipal.com.br/amp,PR,Prefeitura Municipal de Iguatu,iguatu
4110201,http://www.diariomunicipal.com.br/amp,PR,Prefeitura Municipal de Inácio Martins,inacio martins
4110607,http://www.diariomunicipal.com.br/amp,PR,Prefeitura Municipal de Iporã,ipora
4111001,http://www.diariomunicipal.com.br/amp,PR,Prefeitura Municipal de Itambaracá,itambaraca
4111100,http://www.diariomunicipal.com.br/amp,PR,Prefeitura Municipal de Itambé,itambe
4111209,http://www.diariomunicipal.com.br/amp,PR,Prefeitura Municipal de Itapejara d'Oeste,itapejara oeste
4111258,http://www.diariomunicipal.com.br/amp,PR,Prefeitura Municipal de Itaperuçu,itaperucu
4111308,http://www.diariomunicipal.com.br/amp,PR,Prefeitura Municipal de Itaúna do Sul,itauna sul
4111407,http://www.diariomunicipal.com.br/amp,PR,Prefeitura Municipal de Ivaí,ivai
4111605,http://www.diariomunicipal.com.br/amp,PR,Prefeitura Municipal de Ivatuba,ivatuba
4111902,http://www.diariomunicipal.com.br/amp,PR,Prefeitura Municipal de Jaguapitã,jaguapita
4113205,http://www.diariomunicipal.com.br/amp,PR,Prefeitura Municipal de Lapa,lapa
4113254,http://www.diariomunicipal.com.br/amp,PR,Prefeitura Municipal de Laranjal,laranjal
4113502,http://www.diariomunicipal.com.br/amp,PR,Prefeitura Municipal de Loanda,loanda
4113601,http://www.diariomunicipal.com.br/amp,PR,Prefeitura Municipal de Lobato,lobato
4113734,http://www.diariomunicipal.com.br/amp,PR,Prefeitura Municipal de Luiziana,luiziana
4113809,http://www.diariomunicipal.com.br/amp,PR,Prefeitura Municipal de Lupionópolis,lupionopolis
4113908,http://www.diariomunicipal.com.br/amp,PR,Prefeitura Municipal de Mallet,mallet
4114203,http://www.diariomunicipal.com.br/amp,PR,Prefeitura Municipal de Mandaguari,mandaguari
4114302,http://www.diariomunicipal.com.br/amp,PR,Prefeitura Municipal de Mandirituba,mandirituba
4114351,http://www.diariomunicipal.com.br/amp,PR,PREFEITURA MUNICIPAL DE MANFRINÓPOLIS,manfrinopolis
4115002,http://www.diariomunicipal.com.br/amp,PR,Prefeitura Municipal de Marilena,marilena
4115309,http://www.diariomunicipal.com.br/amp,PR,Prefeitura Municipal de Mariópolis,mariopolis
4115705,http://www.diariomunicipal.com.br/amp,PR,Prefeitura Municipal de Matinhos,matinhos
4115739,http://www.diariomunicipal.com.br/amp,PR,Prefeitura Municipal de Mato Rico,mato rico
4116000,http://www.diariomunicipal.com.br/amp,PR,Prefeitura Municipal de Miraselva,miraselva
4116208,http://www.diariomunicipal.com.br/amp,PR,Prefeitura Municipal de Morretes,morretes
4117255,http://www.diariomunicipal.com.br/amp,PR,Prefeitura Municipal de Nova Prata do Iguaçu,nova prata iguacu
4117503,http://www.diariomunicipal.com.br/amp,PR,Prefeitura Municipal de Paiçandu,paicandu
4117701,http://www.diariomunicipal.com.br/amp,PR,Prefeitura Municipal de Palmeira,palmeira
4117800,http://www.diariomunicipal.com.br/amp,PR,Prefeitura Municipal de Palmital,palmital
4118204,http://www.diariomunicipal.com.br/amp,PR,Prefeitura Municipal de Paranaguá,paranagua
4118402,http://www.diariomunicipal.com.br/amp,PR,Prefeitura Municipal de Paranavaí,paranavai
4118501,http://www.diariomunicipal.com.br/amp,PR,Prefeitura Municipal de Pato Branco,pato branco
4118600,http://www.diariomunicipal.com.br/amp,PR,Prefeitura Municipal de Paula Freitas,paula freitas
4118709,http://www.diariomunicipal.com.br/amp,PR,Prefeitura Municipal de Paulo Frontin,paulo frontin
4119004,http://www.diariomunicipal.com.br/amp,PR,Prefeitura Municipal de Pérola D'Oeste,perola oeste
4119103,http://www.diariomunicipal.com.br/amp,PR,Prefeitura Municipal de Piên,pien
4119251,http://www.diariomunicipal.com.br/amp,PR,Prefeitura Municipal de Pinhal de São Bento,pinhal sao bento
4119509,http://www.diariomunicipal.com.br/amp,PR,Prefeitura Municipal de Piraquara,piraquara
4119608,http://www.diariomunicipal.com.br/amp,PR,Prefeitura Municipal de Pitanga,pitanga
4119657,http://www.diariomunicipal.com.br/amp,PR,Prefeitura Municipal de Pitangueiras,pitangueiras
4119806,http://www.diariomunicipal.com.br/amp,PR,Prefeitura Municipal de Planalto,planalto
4119954,http://www.diariomunicipal.com.br/amp,PR,Prefeitura Municipal de Pontal do Paraná,pontal parana
4120002,http://www.diariomunicipal.com.br/amp,PR,Prefeitura Municipal de Porecatu,porecatu
4120101,http://www.diariomunicipal.com.br/amp,PR,Prefeitura Municipal de Porto Amazonas,porto amazonas
4120200,http://www.diariomunicipal.com.br/amp,PR,Prefeitura Municipal de Porto Rico,porto rico
4120333,http://www.diariomunicipal.com.br/amp,PR,Prefeitura Municipal de Prado Ferreira,prado ferreira
4120804,http://www.diariomunicipal.com.br/amp,PR,Prefeitura Municipal de Quatro Barras,quatro barras
4121208,http://www.diariomunicipal.com.br/amp,PR,Prefeitura Municipal de Quitandinha,quitandinha
4121257,http://www.diariomunicipal.com.br/amp,PR,Prefeitura Municipal de Ramilândia,ramilandia
4121356,http://www.diariomunicipal.com.br/amp,PR,Prefeitura Municipal de Rancho Alegre D' Oeste,rancho alegre oeste
4121406,http://www.diariomunicipal.com.br/amp,PR,Prefeitura Municipal de Realeza,realeza
4121604,http://www.diariomunicipal.com.br/amp,PR,Prefeitura Municipal de Renascença,renascenca
4121752,http://www.diariomunicipal.com.br/amp,PR,Prefeitura Municipal de Reserva do Iguaçu,reserva iguacu
4122008,http://www.diariomunicipal.com.br/amp,PR,Prefeitura Municipal de Rio Azul,rio azul
4122172,http://www.diariomunicipal.com.br/amp,PR,Prefeitura Municipal de Rio Branco do Ivaí,rio branco ivai
4122206,http://www.diariomunicipal.com.br/amp,PR,Prefeitura Municipal de Rio Branco do Sul,rio branco sul
4122305,http://www.diariomunicipal.com.br/amp,PR,Prefeitura Municipal de Rio Negro,rio negro
4122404,http://www.diariomunicipal.com.br/amp,PR,Prefeitura Municipal de Rolândia,rolandia
4122800,http://www.diariomunicipal.com.br/amp,PR,PREFEITURA MUNICIPAL DE SALGADO FILHO,salgado filho
4123006,http://www.diariomunicipal.com.br/amp,PR,PREFEITURA MUNICIPAL DE SALTO DO LONTRA,salto lontra
4123105,http://www.diariomunicipal.com.br/amp,PR,Prefeitura Municipal de Santa Amélia,santa amelia
4123204,http://www.diariomunicipal.com.br/amp,PR,Prefeitura Municipal de Santa Cecília do Pavão,santa cecilia pavao
4123303,http://www.diariomunicipal.com.br/amp,PR,PREFEITURA MUNICIPAL DE SANTA CRUZ DE MONTE CASTELO,santa cruz monte castelo
4123600,http://www.diariomunicipal.com.br/amp,PR,PREFEITURA MUNICIPAL DE SANTA INÊS,santa ines
4123824,http://www.diariomunicipal.com.br/amp,PR,Prefeitura Municipal de Santa Lúcia,santa lucia
4123857,http://www.diariomunicipal.com.br/amp,PR,Prefeitura Municipal de Santa Maria do Oeste,santa maria oeste
4124053,http://www.diariomunicipal.com.br/amp,PR,Prefeitura Municipal de Santa Terezinha de Itaipu,santa terezinha itaipu
4124400,http://www.diariomunicipal.com.br/amp,PR,Prefeitura Municipal de Santo Antônio do Sudoeste,santo antonio sudoeste
4124707,http://www.diariomunicipal.com.br/amp,PR,Prefeitura Municipal de São Jerônimo da Serra,sao jeronimo serra
4125357,http://www.diariomunicipal.com.br/amp,PR,Prefeitura Municipal de São Jorge do Patrocínio,sao jorge patrocinio
4125407,http://www.diariomunicipal.com.br/amp,PR,Prefeitura Municipal de São José da Boa Vista,sao jose boa vista
4125456,http://www.diariomunicipal.com.br/amp,PR,PREFEITURA MUNICIPAL DE SÃO JOSÉ DAS PALMEIRAS,sao jose palmeiras
4125753,http://www.diariomunicipal.com.br/amp,PR,Prefeitura Municipal de São Pedro do Iguaçu,sao pedro iguacu
4125902,http://www.diariomunicipal.com.br/amp,PR,Prefeitura Municipal de São Pedro do Paraná,sao pedro parana
4126009,http://www.diariomunicipal.com.br/amp,PR,Prefeitura Municipal de São Sebastião da Amoreira,sao sebastiao amoreira
4126207,http://www.diariomunicipal.com.br/amp,PR,Prefeitura Municipal de Sapopema,sapopema
4126306,http://www.diariomunicipal.com.br/amp,PR,Prefeitura Municipal de Sengés,senges
4126504,http://www.diariomunicipal.com.br/amp,PR,Prefeitura Municipal de Sertanópolis,sertanopolis
4126652,http://www.diariomunicipal.com.br/amp,PR,Prefeitura Municipal de Sulina,sulina
4126900,http://www.diariomunicipal.com.br/amp,PR,Prefeitura Municipal de Tapira,tapira
4127007,http://www.diariomunicipal.com.br/amp,PR,Prefeitura Municipal de Teixeira Soares,teixeira soares
4127205,http://www.diariomunicipal.com.br/amp,PR,Prefeitura Municipal de Terra Boa,terra boa
4127304,http://www.diariomunicipal.com.br/amp,PR,Prefeitura Municipal de Terra Rica,terra rica
4127403,http://www.diariomunicipal.com.br/amp,PR,Prefeitura Municipal de Terra Roxa,terra roxa
4127601,http://www.diariomunicipal.com.br/amp,PR,Prefeitura Municipal de Tijucas do Sul,tijucas sul
4127809,http://www.diariomunicipal.com.br/amp,PR,Prefeitura Municipal de Tomazina,tomazina
4127858,http://www.diariomunicipal.com.br/amp,PR,Prefeitura Municipal de Três Barras do Paraná,tres barras parana
4127882,http://www.diariomunicipal.com.br/amp,PR,Prefeitura Municipal de Tunas do Paraná,tunas parana
4127965,http://www.diariomunicipal.com.br/amp,PR,Prefeitura Municipal de Turvo,turvo
4128203,http://www.diariomunicipal.com.br/amp,PR,Prefeitura Municipal de União da Vitória,uniao vitoria
4128609,http://www.diariomunicipal.com.br/amp,PR,Prefeitura Municipal de Verê,vere
4128708,http://www.diariomunicipal.com.br/amp,PR,Prefeitura Municipal de Vitorino,vitorino
3300159,http://www.diariomunicipal.com.br/aemerj,RJ,Prefeitura Municipal de Aperibé,aperibe
3300225,http://www.diariomunicipal.com.br/aemerj,RJ,Prefeitura Municipal de Areal,areal
3300605,http://www.diariomunicipal.com.br/aemerj,RJ,Prefeitura Municipal de Bom Jesus do Itabapoana,bom jesus itabapoana
3301603,http://www.diariomunicipal.com.br/aemerj,RJ,Prefeitura Municipal de Duas Barras,duas barras
3301801,http://www.diariomunicipal.com.br/aemerj,RJ,Prefeitura Municipal de Engenheiro Paulo de Frontin,engenheiro paulo frontin
3302809,http://www.diariomunicipal.com.br/aemerj,RJ,Prefeitura Municipal de Mendes,mendes
3302858,http://www.diariomunicipal.com.br/aemerj,RJ,Prefeitura Municipal de Mesquita,mesquita
3303955,http://www.diariomunicipal.com.br/aemerj,RJ,Prefeitura Municipal de Pinheiral,pinheiral
3306107,http://www.diariomunicipal.com.br/aemerj,RJ,Prefeitura Municipal de Valença,valenca
3306206,http://www.diariomunicipal.com.br/aemerj,RJ,Prefeitura Municipal de Vassouras,vassouras
2400109,http://www.diariomunicipal.com.br/femurn,RN,Prefeitura Municipal de Acari ,acari
2400307,http://www.diariomunicipal.com.br/femurn,RN,Prefeitura Municipal de Afonso Bezerra,afonso bezerra
2400406,http://www.diariomunicipal.com.br/femurn,RN,Prefeitura Municipal de Água Nova,agua nova
2400505,http://www.diariomunicipal.com.br/femurn,RN,PREFEITURA MUNICIPAL DE ALEXANDRIA,alexandria
2400604,http://www.diariomunicipal.com.br/femurn,RN,Prefeitura Municipal de Almino Afonso,almino afonso
2400802,http://www.diariomunicipal.com.br/femurn,RN,Prefeitura Municipal de Angicos ,angicos
2400901,http://www.diariomunicipal.com.br/femurn,RN,PREFEITURA MUNICIPAL DE ANTÔNIO MARTINS,antonio martins
2401008,http://www.diariomunicipal.com.br/femurn,RN,Prefeitura Municipal de Apodi,apodi
2401107,http://www.diariomunicipal.com.br/femurn,RN,Prefeitura Municipal de Areia Branca ,areia branca
2401404,http://www.diariomunicipal.com.br/femurn,RN,Prefeitura Municipal de Baía Formosa,baia formosa
2401453,http://www.diariomunicipal.com.br/femurn,RN,PREFEITURA MUNICIPAL DE BARAÚNA,barauna
2401503,http://www.diariomunicipal.com.br/femurn,RN,Prefeitura Municipal de Barcelona,barcelona
2401602,http://www.diariomunicipal.com.br/femurn,RN,Prefeitura Municipal de Bento Fernandes ,bento fernandes
2401651,http://www.diariomunicipal.com.br/femurn,RN,Prefeitura Municipal de Bodó,bodo
2401701,http://www.diariomunicipal.com.br/femurn,RN,Prefeitura Municipal de Bom Jesus,bom jesus
2401800,http://www.diariomunicipal.com.br/femurn,RN,Prefeitura Municipal de Brejinho,brejinho
2401859,http://www.diariomunicipal.com.br/femurn,RN,Prefeitura Municipal de Caiçara do Norte,caicara norte
2401909,http://www.diariomunicipal.com.br/femurn,RN,Prefeitura Municipal de Caiçara do Rio do Vento,caicara rio vento
2402006,http://www.diariomunicipal.com.br/femurn,RN,PREFEITURA MUNICIPAL DE CAICÓ,caico
2402105,http://www.diariomunicipal.com.br/femurn,RN,PREFEITURA MUNICIPAL DE CAMPO REDONDO,campo redondo
2402204,http://www.diariomunicipal.com.br/femurn,RN,Prefeitura Municipal de Canguaretama,canguaretama
2402303,http://www.diariomunicipal.com.br/femurn,RN,Prefeitura Municipal de Caraúbas,caraubas
2402402,http://www.diariomunicipal.com.br/femurn,RN,Prefeitura Municipal de Carnaúba dos Dantas,carnauba dantas
2402600,http://www.diariomunicipal.com.br/femurn,RN,Prefeitura Municipal de Ceará-Mirim,ceara mirim
2402709,http://www.diariomunicipal.com.br/femurn,RN,Prefeitura Municipal de Cerro-Corá,cerro cora
2402808,http://www.diariomunicipal.com.br/femurn,RN,Prefeitura Municipal de Coronel Ezequiel ,coronel ezequiel
2402907,http://www.diariomunicipal.com.br/femurn,RN,Prefeitura Municipal de Coronel João Pessoa,coronel joao pessoa
2403004,http://www.diariomunicipal.com.br/femurn,RN,Prefeitura Municipal de Cruzeta,cruzeta
2403103,http://www.diariomunicipal.com.br/femurn,RN,Prefeitura Municipal de Currais Novos,currais novos
2403202,http://www.diariomunicipal.com.br/femurn,RN,Prefeitura Municipal de Doutor Severiano,doutor severiano
2403301,http://www.diariomunicipal.com.br/femurn,RN,PREFEITURA MUNICIPAL DE ENCANTO,encanto
2403400,http://www.diariomunicipal.com.br/femurn,RN,Prefeitura Municipal de Equador,equador
2403509,http://www.diariomunicipal.com.br/femurn,RN,Prefeitura Municipal de Espírito Santo,espirito santo
2403608,http://www.diariomunicipal.com.br/femurn,RN,Prefeitura Municipal de Extremoz,extremoz
2403707,http://www.diariomunicipal.com.br/femurn,RN,Prefeitura Municipal de Felipe Guerra,felipe guerra
2403756,http://www.diariomunicipal.com.br/femurn,RN,Prefeitura Municipal de Fernando Pedroza,fernando pedroza
2403905,http://www.diariomunicipal.com.br/femurn,RN,Prefeitura Municipal de Francisco Dantas,francisco dantas
2404002,http://www.diariomunicipal.com.br/femurn,RN,Prefeitura Municipal de Frutuoso Gomes,frutuoso gomes
2404101,http://www.diariomunicipal.com.br/femurn,RN,Prefeitura Municipal de Galinhos,galinhos
2404200,http://www.diariomunicipal.com.br/femurn,RN,PREFEITURA MUNICIPAL DE GOIANINHA,goianinha
2404309,http://www.diariomunicipal.com.br/femurn,RN,PREFEITURA MUNICIPAL DE GOVERNADOR DIX-SEPT ROSADO,governador dix sept rosado
2404408,http://www.diariomunicipal.com.br/femurn,RN,PREFEITURA MUNICIPAL DE GROSSOS,grossos
2404507,http://www.diariomunicipal.com.br/femurn,RN,PREFEITURA MUNICIPAL DE GUAMARÉ,guamare
2404606,http://www.diariomunicipal.com.br/femurn,RN,PREFEITURA MUNICIPAL DE IELMO MARINHO,ielmo marinho
2404705,http://www.diariomunicipal.com.br/femurn,RN,Prefeitura Municipal de Ipanguaçu,ipanguacu
2404804,http://www.diariomunicipal.com.br/femurn,RN,PREFEITURA MUNICIPAL DE IPUEIRA,ipueira
2404853,http://www.diariomunicipal.com.br/femurn,RN,PREFEITURA MUNICIPAL DE ITAJÁ,itaja
2404903,http://www.diariomunicipal.com.br/femurn,RN,Prefeitura Municipal de Itaú,itau
2405009,http://www.diariomunicipal.com.br/femurn,RN,PREFEITURA MUNICIPAL DE JAÇANÃ,jacana
2405108,http://www.diariomunicipal.com.br/femurn,RN,PREFEITURA MUNICIPAL DE JANDAÍRA,jandaira
2405207,http://www.diariomunicipal.com.br/femurn,RN,Prefeitura Municipal de Janduís,janduis
2405405,http://www.diariomunicipal.com.br/femurn,RN,PREFEITURA MUNICIPAL DE JAPI,japi
2405504,http://www.diariomunicipal.com.br/femurn,RN,PREFEITURA MUNICIPAL DE JARDIM DE ANGICOS,jardim angicos
